{
  "schema_version": "messaging-benchmark.case.v1",
  "backend_id": "pulsar",
  "workload": {
    "scenario": "simultaneous",
    "mode": "single",
    "total_simulated_devices": 640000,
    "payload_mode": "fixed_size",
    "payload_size_bytes": 8192,
    "send_pattern": "steady",
    "virtual_devices_per_rank": 10000,
    "warmup_sec": 15,
    "drain_timeout_sec": 60,
    "duration_sec": 30,
    "latency_clock_max_drift_us": 250.0,
    "latency_clock_samples": 100,
    "latency_clock_max_uncertainty_us": 250.0,
    "latency_sample_every": 10,
    "consumer_ranks": 16,
    "target_records_per_sec": null,
    "producer_ranks": 64,
    "latency_enabled": true
  },
  "backend": {
    "pulsar": {
      "service_count": 1,
      "service_mode": "standalone",
      "topic_name": "persistent://public/default/pulsar-p2m-cfg089-h24-d32",
      "partitions": 90,
      "subscription_name": "messaging-benchmark-pulsar-p2m-cfg089-h24-d32",
      "subscription_type": "shared",
      "profile_id": "PHASE2_HEAP24_DIRECT32",
      "profile_sha256": "544cf58c4200a21c7d0c6dc1534b6c84fe5f880af6fdae880b59c14164afa521",
      "producer": {
        "send_timeout_ms": 120000,
        "compression_type": "none",
        "batching_enabled": true,
        "batching_max_messages": 500,
        "batching_max_bytes": 4194304,
        "batching_max_publish_delay_ms": 5,
        "max_pending_messages": 1000,
        "max_pending_messages_across_partitions": 40000,
        "block_if_queue_full": true
      },
      "consumer": {
        "receiver_queue_size": 2000,
        "max_total_receiver_queue_size_across_partitions": 60000,
        "negative_ack_redelivery_delay_ms": 60000
      },
      "managed_ledger": {
        "ensemble_size": 1,
        "write_quorum": 1,
        "ack_quorum": 1
      },
      "standalone_properties": {
        "allowAutoTopicCreation": false,
        "includeStandardPrometheusMetrics": true,
        "exposeTopicLevelMetricsInPrometheus": false,
        "exposeConsumerLevelMetricsInPrometheus": false
      },
      "runtime": {
        "product_version": "5.0.0-M1",
        "java_major": 21,
        "jvm_memory": "-Xms24g -Xmx24g -XX:MaxDirectMemorySize=32g",
        "functions_worker_enabled": false,
        "stream_storage_enabled": false,
        "storage": "ram-backed"
      }
    }
  },
  "campaign": {
    "case_id": "pulsar-p2m-cfg089-h24-d32",
    "campaign_id": "pulsar-phase2-memory-screening",
    "metadata": {
      "stage": "phase2-memory-screening",
      "anchor_config_id": "cfg_089",
      "anchor_purpose": "qualification-boundary reference",
      "phase1_selection_categories": "qualification-boundary reference",
      "profile_id": "PHASE2_HEAP24_DIRECT32",
      "seed": 20260810,
      "screening_only": true
    }
  },
  "qualification_policy_id": "qualification.pulsar.v1"
}
